{
  "$schema": "./e1-public-ir-traceability.schema.json",
  "schema_version": "1.0.0",
  "profile": "e1-public-ir-core-cpu",
  "source_base_commit": "c475288961d40bb16c4cc10a333034a247acb451",
  "execution_environment": {
    "os": "Ubuntu 24.04.3 LTS; Linux 6.18.35",
    "architecture": "x86_64",
    "compiler": "GCC and G++ 13.3.0; CMake 3.20.5",
    "python": "CPython 3.12.13 executed locally; hosted CPython 3.12 and 3.13 corrective profiles executed and passed on Ubuntu 24.04 x86-64",
    "commands": [
      {
        "id": "public-ir-lot",
        "command": "MORPHOIA_ENGINE_LIBRARY=$PWD/build/engine-cpu-debug/libmorphoia_engine.so PYTHON=/tmp/morphoia-e1-evidence-venv/bin/python bash scripts/validate-engine-ir-lot.sh",
        "status": "PASS",
        "result": "20/20 corpus entries and 60/60 unittest cases passed in 32.615 seconds."
      },
      {
        "id": "direct-bootstrap",
        "command": "MORPHOIA_BOOTSTRAP_FORCE_FALLBACK=1 bash scripts/bootstrap-engine.sh",
        "status": "PASS",
        "result": "C ABI, canonical JSON, core, SHA-256, POSIX CAS, and 20-graph native replay passed."
      },
      {
        "id": "sanitizers",
        "command": "bash scripts/run-engine-sanitizers.sh",
        "status": "PASS",
        "result": "AddressSanitizer and UndefinedBehaviorSanitizer passed; LeakSanitizer remained NOT_RUN."
      },
      {
        "id": "clean-cmake-builds",
        "command": "For each of two fresh local clones with the frozen working-tree lot applied: cmake -S . -B build/clean -G 'Unix Makefiles' -DBUILD_TESTING=ON -DCMAKE_BUILD_TYPE=Debug -DMORPHOIA_WARNINGS_AS_ERRORS=ON; cmake --build; cmake --install; ctest; build and ctest tests/native/consumer",
        "status": "PASS",
        "result": "Both independent clones built and installed; native CTest 7/7 and installed consumer 1/1 passed in each clone."
      },
      {
        "id": "wheel-smoke",
        "command": "MORPHOIA_ENGINE_LIBRARY=$PWD/build/engine-cpu-debug/libmorphoia_engine.so MORPHOIA_WHEEL_BUILD_PYTHON=python3 MORPHOIA_WHEEL_RUNTIME_VENV_TEMPLATE=/tmp/morphoia-e1-evidence-venv bash scripts/validate-engine-wheel.sh",
        "status": "PASS",
        "result": "Isolated installed-wheel origin, validate, replay, and migration passed with hash-locked setuptools 83.0.0 and wheel 0.47.0; byte-for-byte distribution reproducibility NOT_RUN."
      },
      {
        "id": "frozen-evidence",
        "command": "python scripts/extract_engine_requirements.py --check && python scripts/validate_engine_e0_evidence.py && python scripts/validate_engine_e1_native_evidence.py && python scripts/generate_engine_e2_sbom.py --check",
        "status": "PASS",
        "result": "The 320-record baseline and frozen E0/E1/E2 evidence profiles passed exact validation."
      },
      {
        "id": "hygiene",
        "command": "ruff check <public-IR Python surfaces> && bash scripts/scan-secrets.sh && python -m reuse lint && git diff --check",
        "status": "PASS",
        "result": "Ruff, supported credential signatures, REUSE metadata, and whitespace checks passed on the frozen working tree."
      },
      {
        "id": "evidence-profile",
        "command": "python scripts/generate_engine_e1_public_ir_sbom.py --check && python -m unittest -v tests.test_e1_public_ir_evidence",
        "status": "PASS",
        "result": "Deterministic generator check and 22/22 evidence, schema, truth-boundary, mutation, confinement, and atomic-publication tests passed."
      },
      {
        "id": "corrective-hosted-engine",
        "command": "GitHub Actions exact-head push Engine run 31613015834 on c7e21acd30bf3ad2d1e0218ab2a224693c2f626c and PR Engine run 31613019683 on merge ref 6279cdeb074b579aaa03961d679d0420fff5ada3, merging that head into base 12656708ccc3031670c4b3efd43996e46fa27998",
        "status": "PASS",
        "result": "Both Engine matrices passed REUSE, native GCC/C++20, hygiene, Python 3.12, and Python 3.13; each Python job executed the full tests, public-IR lot, hash-locked wheel installation, pip check, and installed-wheel smoke."
      },
      {
        "id": "corrective-hosted-report",
        "command": "GitHub Actions PR report run 31613019691, job 94168845239, for merge ref 6279cdeb074b579aaa03961d679d0420fff5ada3, merging head c7e21acd30bf3ad2d1e0218ab2a224693c2f626c into base 12656708ccc3031670c4b3efd43996e46fa27998",
        "status": "PASS",
        "result": "The PR merge-ref report workflow passed; this is not recorded as an exact-head checkout."
      },
      {
        "id": "python-3-13",
        "command": "Hosted engine CI requirements matrix with Python 3.13",
        "status": "PASS",
        "result": "Corrective push job 94168834734 and PR job 94168845586 passed the exact Python 3.13 full-test, public-IR lot, hash-locked wheel-build, pip-check, and installed-wheel profile."
      },
      {
        "id": "vulnerability-analysis",
        "command": "Component vulnerability analysis for the bounded public-IR distribution",
        "status": "NOT_RUN",
        "result": "CycloneDX inventory generation is not a vulnerability assessment."
      }
    ]
  },
  "entries": [
    {
      "requirement_id": "MOR-IR-001",
      "claim": "The normative public Engine IR manifest uses JSON Schema Draft 2020-12.",
      "status": "PASS",
      "test_ids": [
        "test_schema_identifiers_constants_and_integer_domain_are_frozen"
      ],
      "evidence": [
        "schemas/morphoia-engine-ir-manifest-0.1.0.schema.json",
        "tests/test_engine_ir_contract.py"
      ],
      "reason": "The exact mapped tests were executed on the declared Linux x86-64 core-CPU environment and passed this bounded public-IR contract claim.",
      "blocking_scope": "none-public-ir-core-cpu-profile"
    },
    {
      "requirement_id": "MOR-IR-002",
      "claim": "The signable form uses the published and tested Morphoia Canonical JSON Profile 1.",
      "status": "PASS",
      "test_ids": [
        "native.canonical_json_c_api",
        "test_profile1_two_pass_bytes_and_digest_agree",
        "test_all_twenty_native_content_bytes_and_digests_match_goldens"
      ],
      "evidence": [
        "cpp/include/morphoia/engine.h",
        "tests/native/canonical_json_c_api_test.c",
        "tests/native/ir_replay_test.cpp",
        "tests/test_engine_ir_native.py"
      ],
      "reason": "The exact mapped tests were executed on the declared Linux x86-64 core-CPU environment and passed this bounded public-IR contract claim.",
      "blocking_scope": "none-public-ir-core-cpu-profile"
    },
    {
      "requirement_id": "MOR-IR-003",
      "claim": "Each public Engine IR object distinguishes a logical identity, revision, and content digest.",
      "status": "NOT_RUN",
      "test_ids": [
        "test_identity_is_only_verified_against_native_result",
        "test_linear_revision_and_nonnegative_tolerance_are_explicit",
        "test_all_twenty_native_content_bytes_and_digests_match_goldens"
      ],
      "evidence": [
        "schemas/morphoia-engine-ir-manifest-0.1.0.schema.json",
        "tests/test_engine_ir_contract.py",
        "tests/test_engine_ir_replay.py",
        "docs/engine/evidence/E1_PUBLIC_IR_REPORT.md"
      ],
      "reason": "The 20 synthetic manifests verify the identity/revision/content-digest envelope, but they do not establish the universal all-object claim.",
      "blocking_scope": "universal-object-coverage-not-executed"
    },
    {
      "requirement_id": "MOR-IR-004",
      "claim": "Public Engine IR logical identities use lowercase UUIDv7 text as defined by RFC 9562.",
      "status": "PASS",
      "test_ids": [
        "test_committed_invalid_fixtures_are_rejected_by_declared_stage",
        "test_exactly_twenty_synthetic_inputs_have_indexed_hashes_and_lf_free_goldens"
      ],
      "evidence": [
        "schemas/morphoia-engine-ir-manifest-0.1.0.schema.json",
        "tests/test_engine_ir_contract.py",
        "tests/fixtures/engine-ir/0.1.0/DATA_CARD.md"
      ],
      "reason": "The exact mapped tests were executed on the declared Linux x86-64 core-CPU environment and passed this bounded public-IR contract claim.",
      "blocking_scope": "none-public-ir-core-cpu-profile"
    },
    {
      "requirement_id": "MOR-IR-005",
      "claim": "Each binary reference carries a SHA-256 digest, byte size, media type, and resolvable URI.",
      "status": "NOT_RUN",
      "test_ids": [
        "test_digest_uri_ids_and_references_are_consistent",
        "test_resolver_rejects_mismatch_before_returning_bytes"
      ],
      "evidence": [
        "schemas/morphoia-engine-ir-manifest-0.1.0.schema.json",
        "tests/test_engine_ir_contract.py",
        "tests/test_engine_ir_replay.py",
        "docs/engine/IR_MANIFEST_0_1.md"
      ],
      "reason": "Schema and local resolver tests verify digest, size, media type, URI consistency, and mismatch rejection, but the referenced synthetic payload bytes are absent and all references were not resolved.",
      "blocking_scope": "referenced-payload-bytes-and-complete-resolution-not-executed"
    },
    {
      "requirement_id": "MOR-IR-006",
      "claim": "Units use an unambiguous UCUM-compatible notation with a verifiable factor to SI.",
      "status": "NOT_RUN",
      "test_ids": [
        "test_dimensions_transforms_and_timestamps_are_explicit"
      ],
      "evidence": [
        "schemas/morphoia-engine-ir-manifest-0.1.0.schema.json",
        "tests/test_engine_ir_contract.py",
        "docs/engine/IR_MANIFEST_0_1.md"
      ],
      "reason": "The contract checks positive exact SI factors and unit references, but no complete UCUM code-to-dimension-and-factor semantic verifier was executed.",
      "blocking_scope": "complete-UCUM-code-dimension-factor-verifier-not-implemented"
    },
    {
      "requirement_id": "MOR-IR-007",
      "claim": "Each frame declares dimension, origin, axes, handedness, matrix order, and unit.",
      "status": "PASS",